<?xml version="1.0" encoding="UTF-8"?>
<xs:schema xmlns:xs="http://www.w3.org/2001/XMLSchema" elementFormDefault="qualified"
    targetNamespace="https://github.com/XML-tim17/ScientificArticles"
    xmlns="https://github.com/XML-tim17/ScientificArticles" xmlns:cl="cover-letter" xmlns:ns1="tsp">
    <xs:include schemaLocation="Utility.xsd"/>
    <xs:element name="cover-letter">
        <xs:complexType>
            <xs:sequence>
                <xs:element name="info">
                    <xs:complexType>
                        <xs:sequence>
                            <xs:element name="author">
                                <xs:complexType>
                                    <xs:sequence>
                                        <xs:element name="name" type="xs:string"/>
                                        <xs:element name="institution" type="xs:string"/>
                                        <xs:element name="city" type="xs:string"/>
                                        <xs:element name="country" type="xs:string"/>
                                        <xs:element name="phone-number">
                                            <xs:simpleType>
                                                <xs:restriction base="xs:string">
                                                  <xs:pattern
                                                  value="^[+]*[(]{0,1}[0-9]{1,4}[)]{0,1}[-\s\./0-9]*$"
                                                  />
                                                </xs:restriction>
                                            </xs:simpleType>
                                        </xs:element>
                                        <xs:element name="email">
                                            <xs:simpleType>
                                                <xs:restriction base="xs:string">
                                                  <xs:pattern
                                                  value=" 1 (?:[a-z0-9!#$%&amp;'*+/=?^_`{|}~-]+(?:\.[a-z0-9!#$%&amp;'*+/=?^_`{|}~-]+)*|&quot;(?:[\x01-\x08\x0b\x0c\x0e-\x1f\x21\x23-\x5b\x5d-\x7f]|\\[\x01-\x09\x0b\x0c\x0e-\x7f])*&quot;)@(?:(?:[a-z0-9](?:[a-z0-9-]*[a-z0-9])?\.)+[a-z0-9](?:[a-z0-9-]*[a-z0-9])?|\[(?:(?:25[0-5]|2[0-4][0-9]|[01]?[0-9][0-9]?)\.){3}(?:25[0-5]|2[0-4][0-9]|[01]?[0-9][0-9]?|[a-z0-9-]*[a-z0-9]:(?:[\x01-\x08\x0b\x0c\x0e-\x1f\x21-\x5a\x53-\x7f]|\\[\x01-\x09\x0b\x0c\x0e-\x7f])+)\])"
                                                  />
                                                </xs:restriction>
                                            </xs:simpleType>
                                        </xs:element>
                                    </xs:sequence>
                                </xs:complexType>
                            </xs:element>
                            <xs:element name="editor">
                                <xs:complexType>
                                    <xs:sequence>
                                        <xs:element name="name" type="xs:string"/>
                                        <xs:element name="title" type="xs:string"/>
                                        <xs:element name="institution" type="xs:string"/>
                                    </xs:sequence>
                                </xs:complexType>
                            </xs:element>
                            <xs:element name="date" type="xs:date"/>
                        </xs:sequence>
                    </xs:complexType>
                </xs:element>
                <xs:element name="content">
                    <xs:complexType>
                        <xs:sequence>
                            <xs:element maxOccurs="unbounded" minOccurs="0" name="paragraph"
                                type="TParagraph"/>
                        </xs:sequence>
                    </xs:complexType>
                </xs:element>
                <xs:element name="signature">
                    <xs:complexType>
                        <xs:sequence>
                            <xs:element name="Image" type="xs:base64Binary"/>
                            <xs:element name="name" type="xs:string"/>
                            <xs:element name="title" type="xs:string"/>
                            <xs:element name="institution" type="xs:string"/>
                        </xs:sequence>
                    </xs:complexType>
                </xs:element>
            </xs:sequence>
        </xs:complexType>
    </xs:element>
</xs:schema>
