<?xml version="1.0" encoding="UTF-8"?>
<ns1:cover-letter xmlns:ns1="https://github.com/XML-tim17/ScientificArticles"
 xmlns:xsi="http://www.w3.org/2001/XMLSchema-instance"
 xsi:schemaLocation="https://github.com/XML-tim17/ScientificArticles ./../../coverLetter.xsd">
    <ns1:info>
        <ns1:author>
			<ns1:name>Vladislav UÅ¾asnik</ns1:name>
			<ns1:institution>American University in Bulgaria</ns1:institution>
			<ns1:phone-number>0692772886</ns1:phone-number>
			<ns1:email>author3@mailinator.com</ns1:email>
			<ns1:address>
				<ns1:city>Blagoevgrad</ns1:city>
				<ns1:country>Bulgaria</ns1:country>
			</ns1:address>
        </ns1:author>
        <ns1:date>2020-01-01</ns1:date>
    </ns1:info>
    <ns1:content>
        <ns1:paragraph>
               Nullam lobortis luctus laoreet. Praesent dapibus sollicitudin est a aliquet. Donec et dictum leo. Vestibulum malesuada mollis ultricies. Integer porttitor tristique sapien id facilisis. Sed at commodo enim. Quisque dapibus auctor odio ut pellentesque. Cras eleifend nec ligula id pellentesque. Nulla laoreet dignissim fringilla. Donec purus est, tristique in facilisis et, lobortis et leo. Etiam at quam nec urna tincidunt mollis. Duis a eleifend diam.
        </ns1:paragraph>
        <ns1:paragraph>
Nunc sed tortor non est facilisis pharetra. Etiam nec mi at erat fermentum eleifend sed a odio. Etiam rhoncus sit amet quam non eleifend. Donec sed leo vitae metus feugiat congue. Sed lacinia eu nisi eget ultrices. Aenean congue metus quis arcu dignissim, eget    viverra neque volutpat. Donec rutrum augue pulvinar odio accumsan vestibulum. Cras vitae massa ornare, cursus massa quis, commodo nibh.
        </ns1:paragraph>
    </ns1:content>
    <ns1:signature>
        <ns1:image>iVBORw0KGgoAAAANSUhEUgAAAfQAAACWCAYAAAAonXpvAAAgAElEQVR4Xu2dBdQ1XVXHNyZiKxa2Yit2o4KdiIqFgajY3YEtJnYndiHYXSi2KIhiK9jBwg5s1+9bs9fa6zhz58y993ne+5z5zVrv4uN9587M+Z9z9n/3uV14iYAIiIAIiIAI3HgEbnfjR+AAREAEREAEREAEQkJ3EYiACIiACIjAAAhI6ANMokMQAREQAREQAQndNSACIiACIiACAyAgoQ8wiQ5BBERABERABCR014AIiIAIiIAIDICAhD7AJDoEERABERABEZDQXQMiIAIiIAIiMAACEvoAk+gQREAEREAEREBCdw2IgAiIgAiIwAAISOgDTKJDEAEREAEREAEJ3TUgAiIgAiIgAgMgIKEPMIkOQQREQAREQAQkdNeACIiACIiACAyAgIQ+wCQ6BBEQAREQARGQ0F0DIiACIiACIjAAAhL6AJPoEERABERABERAQncNiIAIiIAIiMAACEjoA0yiQxABERABERABCd01IAIiIAIiIAIDICChDzCJDkEEREAEREAEJHTXgAiIgAiIgAgMgICEPsAkOgQREAEREAERkNBdAyIgAiIgAiIwAAIS+gCT6BBEQAREQAREQEJ3DYiACIiACIjAAAhI6ANMokMQAREQAREQAQndNSACIiACIiACAyAgoQ8wiQ5BBERABERABCR014AIiIAIiIAIDICAhD7AJDoEERABERABEZDQXQMiIAIiIAIiMAACEvoAk+gQREAEREAEREBCdw2IgAiIgAiIwAAISOgDTKJDEAEREAEREAEJ3TUgAiIgAiIgAgMgIKEPMIkOQQREQAREQAQkdNeACIiACIiACAyAgIQ+wCQ6BBEQAREQARGQ0F0DIiACIiACIjAAAhL6AJPoEERABERABERAQncNiIAIiIAIiMAACEjoA0yiQxABEdiEAHLvVSPiMyLiSyLi2zf92ptF4EIRkNAvdGL8LBEQgStBAJn3FhHxudPT7xURj7iSN/lQEbhmBCT0awbc14mACHQjgHy6Y0T8T0Q8oftXh298rYj4+oh4poh4r4j41oj434WfPFVE3C8i3icifiYiPjgi/uVM3+FjRODsCEjoZ4fUB4qACJwBAcj0QyPiIyLiyyLi4yLiP0587stPLvZXnp6Hy/2/DpD5Z0XE+03//uMRce+IePzC/cjSu0TEh0zu/LeJiEed+L3+XAQ2ISChb4LLm0VABK4BAaznT5ks4++JiPeMiL8+8b0vFhEPigjIvOeZd46Ib4sIlACu348I3POPnvmOZ5mUDyz5p42IP46Ie0roJ86YP9+MwN4I/UkmLfr2U9xsSTvfAuSTTc98ijM+c8v7vVcERkLgOSPi8yLirSPiwRHx/mcg82eLiK+IiDePiF+KiPtGxG+vgHaniPjmiLhbue8dp7/Lv3rqiHiPiLj/5MLn7383Ij46Ir77gCt/pPlyLBeEwJ4InbG+fUR8+bTZ3jci/umEuXjKiHjdiPiEiHjFiPjiyT34byc88xJ/eoeIeOIUx7zE7/ObxkHghaZ99PoR8VUR8VER8bcnDg/SxXWO9YzlfJ+I+OmOZ2JpkwH/TuVeFA2+iZj+3SPiAdPe5xZkyZdGxOcccMt3vNZbROB4BPZE6M8REd8wkTBxLjbnsdeLRsRnR8SbTg9A62fj45Yb5SKGiRBEYcGiecgoA3McF4nAS0bEV08ucWLmH3miws0g8Z4RhydWDuGuJcG1wODqxwDI6+ER8cApUS73Pv/2/dM+eaRW+UWurd181J4I/R5T7IyN/UYR8XNHzDIkh1BIFxsZsr8QET88GJlj1XzM9AeccDU+7gi8/IkI9CBQyRwrl0S4U7PJIXP26qdNce1jnkv8/PsiAmNg7vqViPjMidD/vWeg3iMCV4nAXggd9zhutw+IiIdFxDtExF9sBPYFJu2cGlY2MoT3kwO6oqtVs8VFuRFObxeB2xC4CjKv4TVc5z1JcHPT8fST14BkuHoRBvjUiPjKMygeLgMROBsCeyH0l5gSbMh0zThYbwkMiXRY9MTGSJTB1U5TilMtiLNN4hkf1ApCwggkBi3V6Z7x1T5qhwjUzPNzudmBMWvNn3dDEtwc/E86ZduT5MYFkeOC/3zj5DtcrTdgyHsgdMZIQwgImeutIuKhnXNTa2F/JyI+aHKxj0pwJCV94xTHPMZF2Qmrt4lAvEhEfE1EvPoZE+CAtSoJ5/Aw8X18J1nr7Ik/ce5E4FIR2AOhP+O0IXGV0xzinSPiLzsmpNbCspE/cXCtHFf7J02hhGNdlB2weosIRC0jO+daq889B5k7VTcXATyrhEzwpPZ6Y2/uaKcv3wOhv05EfNeUGEPGKy73NQs7a2HfMCI+doqV9Sa9PN0Uo3/vqa3kp9+AVVJd7bgVyTE4JmnwBgz1tk8kyYnMfWqIyab2cI7rm7mWzCkf/fMzvJ7nftFUvw6Zs/9IVl3b62d4tY+4MARqUu/b7Wl/j07oNRmORhI0q3jMyuIj3k4TCnpI42L/kU6hwLtw5398xG3uRLLp8Qr8xIUt9rnP2dLf+gYMZ/ET20YgvWviJo/5kr6dmDYKNfuit8FLz/fXWnMUUpQElDTJvAe9se7Bs0qZIj34WWP0HnnsWENcHs3ohP78k5VMu8cvnMphDlnaHKlIcg5tJj8wIoib91zPN5XHsHjyojHGTTjMocYcKfGh7vwcHfR6cLuue1jnLxsReEtoWpIX/cEP9fO+ru8b/T3g/wZTMhnK7jnd4afUmj/3VKdO8idEcMqFAo+3B/nhdWsQoAUvuVLZDAgPHL0NdqPYjU7o7zZN6Jq1XI9U5FQl6mD/qmNNEqd5y6mEBUGV1zmtj47POPqWU2KZeCRecyo7whraWgZ49Edv/CHf+e4R8cmN0D5n7HbjJ+3qdvYIbk/c4Uma56qeqKEiQN3SOKYqsueYEGQM42JdeR1G4HmmplwodoRF/vsMgOH9obPfm0zPookYbYP/8QzPvjGPGJnQazIcMXTI/e9mZqY2oPi6KWbe0xK2ZsD/5+SaJ16fzWcOHct4CQukuim3KiDVKrpkYqyJjfTY/vWI4BSsc1qIlzCXl/oNtdsg9eBc56yeqKEivGEci9rjXeK7cP3TCe5cF6Vs9KYYrfXzufDJ56Qi9eIbFbBD31FbBnPfVnl27jHesueNTOivNJWakACFhUbpSXuxsbHGyWDnD81nejZkde3Q9hHr712mVqn0esbt0yNYbtXEt25KXFOcLNV70WQHDZie2Jdak1s3+ddOFiJz/NpnFCS9eO3xPtzZdFGrYahztkiuZM7JbBB0755j37NnIfRUNE6Zoy+YDIERe1Ocgsvcb5G3tM0F/3M05qpeRt63a0/JqIROQwhiwcRIf2pyhbWZtJk8gTsQzZqGET0CgQx4XDuc3IQbkbgsZybzjHNaH+feSPm8tnnMTVBAtmKR3cewAujo9S1TjgMu0Zs6XpQwDgXhzyVfrC+UJpTaPNXw9Sa3Ki2EEeKnXpnr8tInzicnJL5URLza9IdcmFfZ8HGQx9YqmA2P99YVBKqXMcmc8yfY75e+T65kckcl9JoMN1eqVsvStiyAjNMQO4YoIHbInMSqS3Y918VTu2iNGGei/zbzgoVODI1e3MwP83yrFa7Msic0Q1nVn3bs6ppQRtjokssJq4udng8kiKFY05zlHIoUWLB+Ub7JWbmO9cs7IXzWFApEXrR/Hr3RVMfyvGW3VC9jfsQ51tgtG9A5XjwqoVNH/U3TmcdtqVq6YhEInLpGfL0nCzJ/h3VAvA4tkN7wkMUPTKUyxGZ7LgQf1iPZ9xy9igv/x6YEvnO47ZjXZ5gEEFhwkeWPB+JB03tHjDOl5cbYIcyfLWS+5ThOErmePSJeISII3bzM1FSII3J/tWeCZ+6pJVskERLmWEvY4TvuPSkivzG5ry+1U1mOjyOFaY9M6SdkjiLFHsO9/fgjseNnCHDWMm2X8a5dx/pt35mff0yjqatYUyfAeaN/WvdFhkx2T+bM6IiEjhWE4CWm3ZaqpYWNS3YLmWebyrtMAuo7prI2XPqctoaVvnZ0KsIBAsfKwl0/VyZz1yMtMObxuSLijSd3J+9hrPUiKexfp/KtEZPC8JpwWAZu3nedDtAhtkr5Ie1s8dSsEcqzTklzuIbBsL0gKZS5njyL+tsaz+/Ffk5oEeL50Yjg+F68UC88eSLofYC1eiuuetYB7wdnMpeZA+aDRETi6NT8H3shtBHYeFz472OOQt36bt5DGI335kWN+4dNynxvo6mrWlNbx9NzP54Uzm74zSlMmUnEOQaUUEIUtzIBsA0ZMi7JfJrdEQk9k+GepmnskskTWFvHkjnCnOQxhNUDIoISN5pYHLLMKZsiCYQaVazxpQshRY30L/bsvOkehCkuSJ5NnW/vdakbIMtZ/may6nrLWSqZY5n//LTJGWePZU7sFCK6z0qSFJYZ9z2xF+jJNZw9y1knPWtvTmgdeiXrBg/PdV/gRrtg2iljhUN2f1QOR0Fp3VJKNvf9KC9Y/PX8ceLzxK57SXUrLtWbkr8l1IGLHQ9Nj0fvKtfU2nieOSLeLCKQD1Tb9CigNbks67fJMcDDSXixGgjsLzxHvR7Jte/d8u81ZIjM3JL/tOU9N/Le0Qid8bDRscxqqVpmpd9zo4CpbnYWDm72D5/IYs3qYzORHESzlkNEngvnUGnd3OIii5iNhjDlYnGTcf/gqTyPfweLWh/PfVuy+fO9hAjwauDupenOuS/mB6LEPYtlhIWMpdBzVTc7ZInHhOxqEuDAnj9LYYz2vWvv23KwD8+qQrLXqmQNv+0Us4UQUfBa1zw1/4QTIJc/iIh/XvvwM/977bjHo1mHxLUhDkIVNPOgHvgU4q39AyAOPGCUHBLeomqlp0/E1mEvxcu3uNivek0dGlPbCRGZReXOmmLM/uY+PI3IIZRiLHE8P68REdW7x/t75zU9h1j4eGp6ko4Pja/2DsBbQriTtX+PKU+D36LA893nCF1uXT+3/P7RCB3yIj5J8kqWqkEQCHiE5JaWkFUYY+lx2hIZ7bStZCFBFEv16mxqiBOCyot7EQxsBly/HBxAok3GuJdK69pF0gqdXNjU4GLZ5sV9PBvFI69jymtqVj+hgu8946pNAYRbPC2ALYlOtaYVrBE8lC8RGjmUfVzdxFXhac+559jcH5zGu+VgH35SM3CZ+57SKuaM8wNIJssa+i3lWGecmtlH8X13n9Y/Smq1ytsxn0K81SpnzUJIKGu94YpjcJhrQLQli/061tTSuPh2GlxxzCtEzLVU3TMnTwiJoJBxoQQwtxgKtL3GO/LLk7yD8HtLD2vIiOcg3/7hmImZftOWpy09aq2J2AmfcPk/HYnQKVWjxhGizR6+EByaJ9baFtdfFcYQA25ECBqiRrBgPc5pm7Vkp2bEYjmTIPTI4q6DdHDfQ0pY1SQNzTW+qauoCnwIEPLjuY9bWGqEFx4SEdSNH5PhXcm89xt7Vv1SGGJLolNucLwguELvMLl/UZYO9eCHKBF8uIfzQinCyiTmm5p9PX1ua21rm4HbG+I4pba6B/dT7qmWJx4C6ohZW+n2rmEC8CR8QZ+CLVclVebx/pNXiJwV1jv7m6S4NYtzyzu5d04Bx6LEa0SZ3ZqL/TrW1NyYlkJuWxSfjJtXlzrzh5WLp4WTypLwe+e1kjnffWoHvbala2KRnhtK1Ph+lPNehWPrGrkR949E6NU6xxrCEobcWUxbukhB5sTHsRohTLrAkci2VqZSO85l5iULDqEEGdZ4H13sSLAiPsU9PaebpXVEkxSev5acU5WSY0rq2qMo7xURjzhxVTMGeqoTd82YKBY/oQ0IuZcE8mQtrFm6+5EQiOcExYmQyFIP/rajFMMhxohV0ipFeCPwboA1SZaQSU8sso1/9ypSlcwvKS5YDx26U+NlqsuhEgMKFQmpa0SYv2/XBXNCXggWHYmAWItbPDe9y5T3UuZIkhffnxeeB2RGT4z4OtbU3Hhq/gL/jgeJvCEOl+o1XuasXnIFqN75temlOa+9+RDt+u91zy/N2RyZU/GBt/Shk1ytYZ5ztRXuXUMXdd8ohF6tc846hxgQ8MSCeq0jJmautpG/X4uh1Y5zOcFL1vOxh0mkwCchiw2L9bMkMCEhlBKygrdYvfntLZmf4yhKBBBaP4oBShIuPk6iw9LDW9ErhNpmEnwzFjSuQay3pdhZ1qdn9jru+dbKzPHXWN1WZYjfQkh4aHrIvCpqCM0tfRGuUpi0JDvnZcr3c2RwEu/WQ4lI4IJAIFAswFSAsQz5e8j2mDW8hg2KColdD2wqTtbCafW517Wm6jshOBQm9suTR8R3Tl0w+Tv2Vq+8Y/zICLwQeaHA1nMs2rDjWgfMlsx7ElIPzVM9OY375jxptYd7z35bWxc3+t9HIfTaSAatGlKn49OWmPFcZjFCH2sSC3spoaOevctiwFUHcSEA225F7Tt6N18SDJromhWLex0hhULTm4hVF3E9V/qUoyjBn3AHwp4yGBJXuPBMIPzxWPDfWMK9OMwpXHhO+D0xwyUFp3YW4xt4P96bucSqKsS2EsnWw25wTZJohzLC1ZMBfx0Cp7rXUb7acET7DXRbJFzxW9M58z0lauwbSktROrNJTA0fXeWRvuwjyIxqlbxY64fCae2Yr2tN4QEgB+jlJvd/lrxiMKB8/NmRjZMIVdGrg9bYuScIL2ZeUFWce4iyTeZEZjK3xybRtmTeetLafI4tsv469tAteccIhM4Y0O7RHuvVswjr/bUcgr9nw2AtHOrm1RLMWoOZ6pbs/T6EK8QHQR9yZc4l5Wx1d53rXGmscYRFdWNWj8VWYYEVhzVFWVv2384kQ5QGhPHSVa1tfnMo/FKzfbfEIXl3G+IgAbNtN1y/sdY5owTiBSFD/1Ze1b0+R7Jz3wbhYNnRKKknVtomcLWJiLyjKkbnPNJ3Kcdla0nada2pGppL7KunBM8kFnZvp0rWKAoB+5OeFbk/28qXYw5fIlmS8Bd79FQyz0Rm9gRX+31V4eTfkQHIup6Q2K3cX1f+7hEIvVrnCdhWN2nVtucEzNxEtNb2mjVXE8x6v69urENZw3NJPQgpyr+WEubaMTEeMlGxtHotc35DRjJxcUgJpYN3tkfJsjEfNVnQW4RFzYInxk4yFNbVIfdvHVcbIzzkCWgTeXpDALyvjmltHaQrO89m3xKvvSqB0LrXe/dAVWLWvCxghNCnGROlUMRBISLGXwUxJIWljJA+JVO+xYpv5bnkWNQDWVo38xrGV72mUF5JQmubG1G2RwiCxkJ4/qr8WfOMVCUKeYniSH99LvI1CFXNJTeuPTexImRGi+UtZM580D+BBEuy6NO71obUkCtUKOEtZY/SNhmPFiGtNe8c9yOfMMp6TtBcm/uL//ebTuhz1nkvWebkVG2bciGScXomv1r0h6y5dhGuCfy6aNjYxKEgWKyfNmu4tajqb7fUcvO7rS5ONh5ETXiBjGRcZLRcbS9ifLVkJZPNDmXM4qYnaQ6PBCU0CCCsCtyDrQBa2mStYDjkEUEhInaYme9r5FTfSfkhjTggKgQgYyXEMHdVzPh3wjl81620LGrtMjFZwhEQ7doeqArgoT3XZmI/fHIhkz0+N27a7bJmWE/EhCGwtYsGKHhXqNdvwy6tApXPYnxbLburXFPgROkZ4Y22dwTf3DZzqTgtKZ9gcrcpwZfGUyS1UmlzvwmEuXWeXkRuWQvvZR4CCgF7nw6BhFEOudnb+ahex7n8GOQl+4v1cN/JaCAMRDknnsul7o9ZeUClD0mVhGGHv246obeu3S1kyeSygFgYLPBeixayYXOwiYhDHYpTt00mety4zAlZ2xADBINlSv91vjHLdeYsqmwCAeFtbVJTcVwjMzBD0OLqo+aVkj60bAQviUxsNhqAZPJZbZdalae2BAmBhtuWcaO8sCER/ngMcLdTE95bOocVhWsd5YxriXDmmv/0hEIQlIwPAQMWkMiS0sX7EXz0OCdGjIKyVjFxXYKHuCzZ6AjxXq9HflsqgPz/uQoIsOVQE6xiPDdZ04xSupSPUs8pX2uzS7MS9iFrg++nBJQ5r0mRVYGqVjnWHuv3hzacysWeq30dzr2mqNhAKeQ7aelLHgI5Hvw9F/jx/ic0IYm2AoPvJFGMPUR1Dv+NNyT7X1CKhmI813RprlvcXF5KK3/4Ppoc8c6l/In05uEhYb1w8e0oVX8/lQ7yjTxj6ULW